queryItem,queryIndex,stringId,ncbiTaxonId,taxonName,preferredName,annotation,gene_set
C6,0,9606.ENSP00000263413,9606,Homo sapiens,C6,Complement component C6; Constituent of the membrane attack complex (MAC) that plays a key role in the innate and adaptive immune response by forming pores in the plasma membrane of target cells.,mirna_mrna_axis_targets_all
CCDC113,1,9606.ENSP00000219299,9606,Homo sapiens,CCDC113,Coiled-coil domain-containing protein 113; Component of centriolar satellites contributing to primary cilium formation.,mirna_mrna_axis_targets_all
CDH2,2,9606.ENSP00000269141,9606,Homo sapiens,CDH2,"Cadherin-2; Calcium-dependent cell adhesion protein; preferentially mediates homotypic cell-cell adhesion by dimerization with a CDH2 chain from another cell. Cadherins may thus contribute to the sorting of heterogeneous cell types. Acts as a regulator of neural stem cells quiescence by mediating anchorage of neural stem cells to ependymocytes in the adult subependymal zone: upon cleavage by MMP24, CDH2-mediated anchorage is affected, leading to modulate neural stem cell quiescence. CDH2 may be involved in neuronal recognition mechanism. In hippocampal neurons, may regulate dendritic s [...] ",mirna_mrna_axis_targets_all
CHST9,3,9606.ENSP00000480991,9606,Homo sapiens,CHST9,"Carbohydrate sulfotransferase 9; Catalyzes the transfer of sulfate to position 4 of non- reducing N-acetylgalactosamine (GalNAc) residues in both N-glycans and O-glycans. Participates in biosynthesis of glycoprotein hormones lutropin and thyrotropin, by mediating sulfation of their carbohydrate structures. Has a higher activity toward carbonic anhydrase VI than toward lutropin. Only active against terminal GalNAcbeta1,GalNAcbeta. Isoform 2, but not isoform 1, is active toward chondroitin.",mirna_mrna_axis_targets_all
CLDN1,4,9606.ENSP00000295522,9606,Homo sapiens,CLDN1,"Claudin-1; Claudins function as major constituents of the tight junction complexes that regulate the permeability of epithelia. While some claudin family members play essential roles in the formation of impermeable barriers, others mediate the permeability to ions and small molecules. Often, several claudin family members are coexpressed and interact with each other, and this determines the overall permeability. CLDN1 is required to prevent the paracellular diffusion of small molecules through tight junctions in the epidermis and is required for the normal barrier function of the skin. [...] ",mirna_mrna_axis_targets_all
FAM81B,5,9606.ENSP00000283357,9606,Homo sapiens,FAM81B,Protein FAM81B; Family with sequence similarity 81 member B.,mirna_mrna_axis_targets_all
GOLM1,6,9606.ENSP00000373364,9606,Homo sapiens,GOLM1,Golgi membrane protein 1; Unknown. Cellular response protein to viral infection.,mirna_mrna_axis_targets_all
LRRN1,7,9606.ENSP00000314901,9606,Homo sapiens,LRRN1,Leucine rich repeat neuronal 1.,mirna_mrna_axis_targets_all
LTBP1,8,9606.ENSP00000386043,9606,Homo sapiens,LTBP1,"Latent-transforming growth factor beta-binding protein 1; Key regulator of transforming growth factor beta (TGFB1, TGFB2 and TGFB3) that controls TGF-beta activation by maintaining it in a latent state during storage in extracellular space. Associates specifically via disulfide bonds with the Latency-associated peptide (LAP), which is the regulatory chain of TGF-beta, and regulates integrin-dependent activation of TGF-beta. Outcompeted by LRRC32/GARP for binding to LAP regulatory chain of TGF-beta. Belongs to the LTBP family.",mirna_mrna_axis_targets_all
MNS1,9,9606.ENSP00000260453,9606,Homo sapiens,MNS1,Meiosis-specific nuclear structural protein 1; May play a role in the control of meiotic division and germ cell differentiation through regulation of pairing and recombination during meiosis; Belongs to the MNS1 family.,mirna_mrna_axis_targets_all
PTGFRN,10,9606.ENSP00000376899,9606,Homo sapiens,PTGFRN,"Prostaglandin F2 receptor negative regulator; Inhibits the binding of prostaglandin F2-alpha (PGF2-alpha) to its specific FP receptor, by decreasing the receptor number rather than the affinity constant. Functional coupling with the prostaglandin F2-alpha receptor seems to occur (By similarity). In myoblasts, associates with tetraspanins CD9 and CD81 to prevent myotube fusion during muscle regeneration (By similarity).",mirna_mrna_axis_targets_all
RPGRIP1L,11,9606.ENSP00000493946,9606,Homo sapiens,RPGRIP1L,"Protein fantom; Negatively regulates signaling through the G-protein coupled thromboxane A2 receptor (TBXA2R). May be involved in mechanisms like programmed cell death, craniofacial development, patterning of the limbs, and formation of the left-right axis (By similarity). Involved in the organization of apical junctions; the function is proposed to implicate a NPHP1-4-8 module. Does not seem to be strictly required for ciliogenesis. Involved in establishment of planar cell polarity such as in cochlear sensory epithelium and is proposed to implicate stabilization of disheveled proteins [...] ",mirna_mrna_axis_targets_all
RSPH4A,12,9606.ENSP00000229554,9606,Homo sapiens,RSPH4A,"Radial spoke head protein 4 homolog A; Probable component of the axonemal radial spoke head. Radial spokes are regularly spaced along cilia, sperm and flagella axonemes. They consist of a thin stalk which is attached to a subfiber of the outer doublet microtubule, and a bulbous head which is attached to the stalk and appears to interact with the projections from the central pair of microtubules.",mirna_mrna_axis_targets_all
SERPINB5,13,9606.ENSP00000372221,9606,Homo sapiens,SERPINB5,"Serpin B5; Tumor suppressor. It blocks the growth, invasion, and metastatic properties of mammary tumors. As it does not undergo the S (stressed) to R (relaxed) conformational transition characteristic of active serpins, it exhibits no serine protease inhibitory activity; Belongs to the serpin family. Ov-serpin subfamily.",mirna_mrna_axis_targets_all
SIX4,14,9606.ENSP00000216513,9606,Homo sapiens,SIX4,"Homeobox protein SIX4; Transcriptional regulator which can act as both a transcriptional repressor and activator by binding a DNA sequence on these target genes and is involved in processes like cell differentiation, cell migration and cell survival. Transactivates gene expression by binding a 5'-[CAT]A[CT][CT][CTG]GA[GAT]-3' motif present in the Trex site and a 5'-TCA[AG][AG]TTNC-3' motif present in the MEF3 site of the muscle-specific genes enhancer. Acts cooperatively with EYA proteins to transactivate their target genes through interaction and nuclear translocation of EYA protein.  [...] ",mirna_mrna_axis_targets_all
TP63,15,9606.ENSP00000264731,9606,Homo sapiens,TP63,Tumor protein 63; Acts as a sequence specific DNA binding transcriptional activator or repressor. The isoforms contain a varying set of transactivation and auto-regulating transactivation inhibiting domains thus showing an isoform specific activity. Isoform 2 activates RIPK4 transcription. May be required in conjunction with TP73/p73 for initiation of p53/TP53 dependent apoptosis in response to genotoxic insults and the presence of activated oncogenes. Involved in Notch signaling by probably inducing JAG1 and JAG2. Plays a role in the regulation of epithelial morphogenesis. The ratio o [...] ,mirna_mrna_axis_targets_all
